2653,"Erskine 2010","Inter-individual variability in the adaptation of human muscle specific tension to progressive resistance training.","Paula Pino","Erskine 2010","Inter-individual variability in the adaptation of human muscle
specific tension to progressive resistance training","UK","Femur length was measured as the distance from the tibi-
ofemoral point of contact to the proximal insertion of the
VL muscle, identified using ultrasonography. Oil-filled beads were attached to the
skin at the measurement location (corresponding to 40% of
femur length from the distal end). 
The participant was
scanned in the supine position, and five serial axial slices
were acquired around the position of the beads using a spin
echo T1-weighted protocol. 
Slice thickness 5 mm; interslice gap 5 mm.
The ACSA
of each constituent QF muscle and a series of regression
equations, QF volume was estimated by adapting a previously published method (Morse et al. 2007)
","During MVC at optimum knee joint angle, ultrasound
scans of the vastus lateralis (VL) muscle fascicle length
(Lf) and pennation angle (hp) were acquired at 50% of the
muscle length along the mid-sagittal plane and Lf and hp
were subsequently measured using digitizing software.","Dividing the estimated QF volume by VL Lf.","Isometric leg-extension MVC torque was assessed using an
isokinetic dynamometer (Cybex Norm, Cybex International, NY, USA), with the knee joint angle set at 70–90 knee flexion (depending on the angle at which peak torque was produced, defined as the optimum angle). Each MVC lasted 2–3 s and there was a rest-interval of 60 s between each contraction. 
Biceps femoris muscle EMG activity was recorded during isometric knee flexion MVC at optimum joint angle (Kellis and Baltzopoulos 1997), and
the torque produced by the hamstrings during knee extension MVC was estimated assuming a linear relationship
between torque and EMG activity (Reeves et al. 2004). The addition of the estimated antagonist torque during MVC knee extension to the actual MVC knee extension torque provided the overall MVC knee extension torque.","The patellar tendon moment arm (dPT) was quantified using a
0.2-T magnetic resonance imaging (MRI) scanner. PT was defined
as the length of the perpendicular line between the axis of the
patellar tendon and the TFCP (Tsaopoulos et al. 2006). This value
was subsequently multiplied by 1.14 to account for a 14%
increase in dPT from rest to MVC (Tsaopoulos et al. 2007).
Maximum isometric QF force (F) was thus calculated as:
F = TMT/dPT","","","","","","","","Non-randomised experimental study","53 untrained","20 SD 3","178 SD 5","77 SD 11","","","","","","","","","","","","","","","","","53 Before training","Male","QF","2080 SD 254","8.9 SD 1.3","237 SD 41","V and S ","246 SD 51","5722 SD 1036","25.6 SD 5.1","Femur length was measured as the distance from the tibi-
ofemoral point of contact to the proximal insertion of the
VL muscle, identified using ultrasonography. Oil-filled beads were attached to the
skin at the measurement location (corresponding to 40% of
femur length from the distal end). 
The participant was
scanned in the supine position, and five serial axial slices
were acquired around the position of the beads using a spin
echo T1-weighted protocol. 
Slice thickness 5 mm; interslice gap 5 mm.
The ACSA
of each constituent QF muscle and a series of regression
equations, QF volume was estimated by adapting a previously published method (Morse et al. 2007)
","During MVC at optimum knee joint angle, ultrasound
scans of the vastus lateralis (VL) muscle fascicle length
(Lf) and pennation angle (hp) were acquired at 50% of the
muscle length along the mid-sagittal plane and Lf and hp
were subsequently measured using digitizing software.","Dividing the estimated QF volume by VL Lf.","Isometric leg-extension MVC torque was assessed using an
isokinetic dynamometer (Cybex Norm, Cybex International, NY, USA), with the knee joint angle set at 70–90 knee flexion (depending on the angle at which peak torque was produced, defined as the optimum angle). Each MVC lasted 2–3 s and there was a rest-interval of 60 s between each contraction. 
Biceps femoris muscle EMG activity was recorded during isometric knee flexion MVC at optimum joint angle (Kellis and Baltzopoulos 1997), and
the torque produced by the hamstrings during knee extension MVC was estimated assuming a linear relationship
between torque and EMG activity (Reeves et al. 2004). The addition of the estimated antagonist torque during MVC knee extension to the actual MVC knee extension torque provided the overall MVC knee extension torque.","The patellar tendon moment arm (dPT) was quantified using a
0.2-T magnetic resonance imaging (MRI) scanner. PT was defined
as the length of the perpendicular line between the axis of the
patellar tendon and the TFCP (Tsaopoulos et al. 2006). This value
was subsequently multiplied by 1.14 to account for a 14%
increase in dPT from rest to MVC (Tsaopoulos et al. 2007).
Maximum isometric QF force (F) was thus calculated as:
F = TMT/dPT","QF PCSA was multiplied by the cosine of the VL hp [which can be used as an approximation of the hp for the whole QF
muscle (Erskine et al. 2009)] to provide the reduced QF PCSA. Force was subsequently divided by the reduced
QF PCSA to provide QF specific tension.","","53 after training ","Male","QF","2201 SD 277","8.9 SD 1.4","251 SD 43","V and S","310 SD 62","6968 SD 1343","29.8 SD 6.4","","","","","","","","","","","","","","","","","","","","","","","","","","","","","","","","","","","","","","","","","","","","","","","","","","","","","","","","","","","","","","","","","","","","","","","","","","","","","","","","","","","","","","","","","","","","","","","","","","","","","","","","","",""
2653,"Erskine 2010","Inter-individual variability in the adaptation of human muscle specific tension to progressive resistance training.","Lomas Persad","Erskine 2010","Inter-individual variability in the adaptation of human muscle specific tension to progressive resistance training","UK","Femur length was measured as the distance from the tibiofemoral point of contact to the proximal insertion of the VL muscle identified using ultrasonography
 Together with the femur length, the ACSA of each constituent QF muscle and a series of regression equations, QF volume was estimated by adapting a previously published method (Morse et al. 2007)","During MVC at optimum knee joint angle, ultrasound
scans of the vastus lateralis (VL) muscle fascicle length
(Lf) and pennation angle (hp) were acquired at 50% of the
muscle length along the mid-sagittal plane"," QF PCSA was calculated
by dividing the estimated QF volume by VL Lf","Isometric leg-extension MVC torque was assessed using an isokinetic dynamometer with the knee joint angle set at 70–90 knee flexion (depending on the angle at which peak torque was produced, defined as the optimum angle
True maximal torque (TMT) was calculated as:
TMT= MVCcorr/ (1-t/T)
where t is the amplitude of the superimposed twitch, T the value of the twitch before the MVC and MVCcorr is the MVC corrected for co-activation.","The patellar tendon moment arm (dPT) was quantified using a 0.2-T magnetic resonance imaging (MRI) scanner 
Previously reported values of dPT length at full extension (0 knee flexion) and optimum angle (Baltzopoulos 1995) were
used to estimate dPT at optimum knee joint angle. This value was subsequently multiplied by 1.14 to account for a 14% increase in dPT from rest to MVC (Tsaopoulos et al. 2007)","using method 2 of Erskine 2009

Training-
unilateral knee
extension exercises were performed three times a week for a period of 9 weeks on the right leg. The single repetition maximum (1 RM) was determined at the beginning of the training programme and reassessed at the start of each week on a standard leg-extension machine
","","","","","","","Cohort study","53 untrained males","20 ± 3","178 ± 5","77 ± 11","","","","","","","","","","","","","","","","","53","m","QF, before training","2080 ± 254","8.9 ± 1.3","237 ± 41","mixed","246 ± 51","5722 ± 1036","25.6 ± 5.1","MRI and literature regression","Ultrasound of VL during MVC","rPCSA=VOL*cos(alpha_VL)/fiber length_VL","MVC corrected for antagonist co activation, and activation level","calculated using measured moment arm at full extension and literature values for optimal joint + 14% correction due to an increase from rest to MVC.","ST= force/rPCSA","","53","m","QF, after training","2201 ± 277","8.9 ± 1.4","251 ± 43","mixed","310 ± 62","6968 ± 1343","29.8 ± 6.4","same","same","same","same","same","same","","","","","","","","","","","","","","","","","","","","","","","","","","","","","","","","","","","","","","","","","","","","","","","","","","","","","","","","","","","","","","","","","","","","","","","","","","","","","","","","","","","","","","","","","","","","","","","","","","","",""
2664,"Erskine 2011","What causes in vivo muscle specific tension to increase following resistance training?","Paula Pino","Erskine 2011","What causes in vivo muscle specific tension to increase
following resistance training?","UK","Calculated based on the equation by Morse et al. 2007 using: 
Femur length: measured with ultrasound
ACSA: MRI taken at 40% of femur length and calculating the area of each muscle. ","Using the method 2 of Erskine et al 2009. 
During MVC at the optimal knee angle, VL muscle fascicle length was measured using ultrasonography. This measurement was taken at a 50% of femur length along the mid-sagittal plane of the VL muscle","At 40% of femur length MRI was used to measure each component of QF muscle. 
Calculated by dividing Vm by VL fascicle length","Isometric leg extension MVC were performed on a dynamometer at optimal knee joint angle. Antagonist muscle coactivation estimated assuming a linear relationship between torque and EMG activity of biceps femoris. 
Interpolated twitch technique used to determine max volunatry QF muscle activation. 
Patellar tendon moment arm: MRI
Correcting MVC torque for QF muscle activation and antag coact. true maximal torque."," Maximal patellar tendon force calculated with: 
F = TMT x d(PT)-1","","17 participants: Volume of each constituent muscle was measured. ","17 participants: Using method 1 of Erskine et al. 2009 
Fascicle length and pennation angle determined for each of the 4 heads of the QF. ","","","","","Non-randomised experimental study","Untrained males/ Quadriceps femoris","20 SD 3","178 SD 6","74 SD 9","","","","","","","","","","","","","","","","","Method 2 Before training
42","Male","Quadriceps femoris","2084 SD 243","8.9 SD 1.4 
","238 SD 41","Voluntary","248 SD 50","5809 SD 1067
","25.9 SD 5.3","Calculated based on the equation by Morse et al. 2007 using: 
Femur length: measured with ultrasound
ACSA: MRI taken at 40% of femur length and calculating the area of each muscle. ","Using the method 2 of Erskine et al 2009. 
During MVC at the optimal knee angle, VL muscle fascicle length was measured using ultrasonography. This measurement was taken at a 50% of femur length along the mid-sagittal plane of the VL muscle","At 40% of femur length MRI was used to measure each component of QF muscle. 
Calculated by dividing Vm by VL fascicle length","Isometric leg extension MVC were performed on a dynamometer at optimal knee joint angle. Antagonist muscle coactivation estimated assuming a linear relationship between torque and EMG activity of biceps femoris. 
Interpolated twitch technique used to determine max volunatry QF muscle activation. 
Patellar tendon moment arm: MRI
Correcting MVC torque for QF muscle activation and antag coact. true maximal torque."," Maximal patellar tendon force calculated with: 
F = TMT x d(PT)-1","PCSA multiplied by the cosine of VL θp to provide reduced QF PCRSA. 
Max patellar force divided by the reduced QF PCSA to profide QF specific tension. ","","Method 2 After training
42","","","2200 SD 277","8.9 SD 1.4","253 SD 43","","315 SD 64","7152 SD 1386","30.3 SD 6.7","","","","","","","","Method 1 Before training
17","","","2116 SD 257
","9.1 SD 1.3","235 SD 35","","244 SD 55","5896 SD 1151","26.5 SD 5.4","17 participants: Volume of each constituent muscle was measured. ","17 participants: Using method 1 of Erskine et al. 2009 
Fascicle length and pennation angle determined for each of the 4 heads of the QF. ","","","","","","Method 1 After training
17 ","","","2237 SD 309","9.0 SD 1.5","252 SD 41","","315 SD 66","7316 SD 1357","30.8 SD 5.3","","","","","","","","","","","","","","","","","","","","","","","","","","","","","","","","","","","","","","","","","","","","","","","","","","","","","","","","","","","","","","","","","","","","","","","",""
2664,"Erskine 2011","What causes in vivo muscle specific tension to increase following resistance training?","Lomas Persad","Erskine 2011","What causes in vivo muscle specific tension to increase
following resistance training?","UK","multiple MRI to create volume ","ultrasound measured during MVC","individual muscle volume/fiber length ","Correcting MVC torque for QF muscle activation and
antagonist muscle coactivation provided true maximal
torque"," patellar tendon moment arm
(dPT) was determined via MRI","QF specific tension was determined from measurements
of maximal voluntary contractions of the QF muscle
with superimposed electrical stimulation and antagonist
muscle activity assessed from EMG signals, together with
a magnetic resonance imaging (MRI) measurement of
ACSA and determination of fascicle pennation angle and
length for the vastus lateralis (VL) muscle, as described
in method 2 of Erskine et al. 2009","one MRI 40% femur length and regression to estimate volume","","Muscle volume/ VL fiber length.
VL assumed to represent average architecture of QF","","","","","Forty-two untrained males","20 ± 3","178 ± 6","74 ± 9","","","","","","","","","","","","","","","","","Method 1 before training: n=17","m","QF","2116 ± 257","VL fl:
 9.1 ± 1.3","235 ± 35
","both","244 ± 55","5896 ± 1151","26.5 ± 5.4","Multiple MRI","ultrasound measured during MVC","individual muscle volume/fiber length

for each muscle
rPCSA=vol*cos(alpha)/fiber length","Correcting MVC torque for QF muscle activation and
antagonist muscle coactivation","using lit moment arm.","force/reduced pcsa","Method 1 more detailed. individual muscle volume measured from multiple MRI scans and individual fiber length","Method 1 After training: n=17","m","QF"," 2237 ± 309","VL fl:
 9.0 ± 1.5 ","
 252 ± 41","both"," 315 ± 66"," 7316 ± 1357"," 30.8 ± 5.3","","same","","","","","","Method 2 before training: n=42","m","QF"," 2084 ± 243","VL fl:
  8.9 ± 1.4"," 238 ± 41","both"," 248 ± 50"," 5809 ± 1067"," 25.9 ± 5.3","single MRI and regression","only VL fl used ","rPCSA=vol*cos(alpha_VL)/fiber length_VL
","same","same","same","","Method 2 After training: n=42","m","QF"," 2200 ± 277","VL fl:
8.9 ± 1.4"," 253 ± 43","both"," 315 ± 64"," 7152 ± 1386"," 30.3 ± 6.7","","","","","","","","","","","","","","","","","","","","","","","","","","","","","","","","","","","","","","","","","","","","","","","","","","","","","","","","","","","","","","","","","","","","","","","",""
2672,"Gorgey 2006","Effects of neuromuscular electrical stimulation parameters on specific tension.","Paula Pino","Gorgey 2006","Effects of neuromuscular electrical stimulation parameters on specific tension","United States","","","","","Each subject was asked to extend against the immobile lever
arm as quickly and hard as possible for 3 s. Three trials were performed and 1 min of rest was given between subsequent trials on each thigh. All force measures were gravity compensated","","","","","","","","","7","28 SD 4","173 SD 9","68 SD 9","","","","","","","","","","","","","","","","","7","6/7 Male ","","","","","","","","","","","","","","","","","","","","","","","","","","","","","","","","","","","","","","","","","","","","","","","","","","","","","","","","","","","","","","","","","","","","","","","","","","","","","","","","","","","","","","","","","","","","","","","","","","","","","","","","","","","","","","","","","","","","","","","","","","","","","","","","","","",""
2672,"Gorgey 2006","Effects of neuromuscular electrical stimulation parameters on specific tension.","Lomas Persad","Gorgey 2006","Effects of neuromuscular electrical stimulation parameters on specific tension","United States","MRI scans were taken of both thighs prior to
the SNMES. Following each protocol, images were immediately (3 § 0.2 min) collected again

Fourteen to 18 slices for each subject were analyzed beginning with the first proximal slice visualizing the four heads of the mQF group and continued distally until the slice just before the top of the patella. 

Muscle volume (cm3) was calculated by multiplying the activated CSA (cm2) in each
slice * 2 cm (slice thickness + interslice space). The slices
were then added together to calculate the volume of acti-
vated tissue","Vastus lateralis muscle can be used as surrogate of mQF (Trappe et al. 2001; Reeves et al. 2004). Fiber length was identifed by the following equation after measuring muscle length (fiber length/ muscle length = 0.23) Wickiewicz et al. 1983).

pennation angle of 15.6° was acquired from previously published data, which is the pennation angle of m. vastus lateralis at 60° of knee joint below horizontal during isometric contraction (Fukunaga et al. 1997; Ichinose et al. 1997)


Muscle length was measured as the distance between the most proximal and the most distal points in which the muscle was visible in three scout views captured with MRI (Fukunaga et al. 1992; Narici et al. 1992). Adjustments were made to account for Wber length during isometric actions at diVerent percentages of MVIT (Ichinose et al. 1997). The resting length was multiplied
by the percentage changes in fiber length when torque was 75, 30, 60, and 45% of MVIT for RES, PD, FREQ,
and AMP, 

","The PCSA of mQF was calculated as follows. PCSA = [muscle volume * COS (pennation angle)]/fiber length","maximum voluntary isometric torque (MVIT) on each thigh and the highest torque was considered his/her MVIT
The subject sat on a custom-built chair, and the leg was strapped at knee joint angle of 60° below horizontal to a rigid lever arm with an inelastic strap to ensure that the knee extensors could perform only isometric actions he lever arm was established by mounting a load cell perpendicular to and 12 in. (33 cm) from the axis of rotation of the lever arm."," All force measures were gravity compensated

torque/ patella moment arm derived from cadavers

The moment arm was derived from cadavers and knee joints of able bodies, 0.04 m, at the same knee joint angle used in our study (Baltzopoulos 1995; Wickiewicz et al. 1983, 1984). Because the moment arm increases with muscle contraction and moment arm from cadavers shrinks after death, the percentage increase in the moment arm during ankle extension, 18%, was used in the calculation of the moment arm length for this lower extremity, extensor muscle group (Maganaris et al. 2001). A moment arm length of 0.047 m was used to correct torque to force","Four protocols of electrical stimulation were randomly delivered to both quadriceps femoris muscle (mQF)


All stimulation protocols were performed on one day.
SNMES was applied to the mQF via surface electrodes
to induce intermittent, isometric actions.

These protocols were: (1)
Research protocol (RES): 100 Hz, 450 s pulses, and
mAMP set to evoke 75% of MVIT. 
(2) Pulse duration
protocol (PD): 100 Hz, 150 s, the same current as in
RES. 
(3) Frequency protocol (FREQ): 25 Hz, 450 s,
and the same current as in RES. 
(4) Amplitude protocol
(AMP): 100 Hz, 450 s, and amplitude set to evoke the
average of the initial torques of PD and FREQ, 45 § 9%
of MVIT.

ST= force was divided by the PCSA of activated skeletal muscle.","","","","","","","","n=7, 1 Female","28 ± 4","173 ± 9","68 ± 9","RES","","","","","PD","","","","","FREQ","","","","","AMP","7, RES","1F,6M","mQF","900 ± 200","5.6 ± 0.3","145 ± 33","S","166","3532","25 ± 6","MRI, measured for activated portion only","VL fiber length :muscle length ratio from lit.= 0.23

Adjustments were made to account for fiber length during isometric actions at different percentages of MVIT","[muscle volume * COS (pennation angle_VL)]/fiber length_VL","Torque measured for 4 stim protocols , submax.","lit value of patella moment arm=0.047m","Force/ active PCSA","","7,PD","","","500 ± 300","6 ± 0.3","83 ± 47","S","78","1660","20 ± 7","","","","","","","","7, FREQ","","","1000 ± 250","5.7 ± 0.3","171 ± 35","S","138","2936","17 ± 4","","","","","","","","7, AMP","","","600 ± 300","5.8 ± 0.3","101 ± 55","S","110","2340","26 ± 8","","","","","","","7, Total","","","1900 ± 400","7.1 ± 0.3","253 ± 49","S","","","20 ± 3","","","","","","","","","","","","","","","","","","","","","","","","","","","","","","","","","","","","","","","","","","","","","","","","","","","","","","","","The MVIT of the right and left mQFs was 242 ± 66 and 226 ± 60 Nm, respectively"
2680,"Erskine 2010","Resistance training increases in vivo quadriceps femoris muscle specific tension in young men.","Paula Pino","Erskine 2010 Acta Phys","Resistance training increases in vivo quadriceps femoris
muscle specific tension in young men","UK"," The volume of each
of the component QF muscles [vastus lateralis (VL), vastus intermedius (VI), rectus femoris (RF) and vastus medialis (VM)] was calculated from serial axial MRI","Fascicle length (Lf) and pennation angle (hp) of the VL, VI, RF and VM muscles were measured during MVC using ultrasonography along the mid-sagittal plane at
50% of the length of each muscle. ","Dividing each compo-
nent muscle volume by its respective Lf provided the PCSA of the individual muscles. he sum of these four PCSAs gave the whole QF PCSA (Erskine et al. 2009).","dPT was determined from sagittal and coronal-plane knee scans
obtained from a magnetic resonance imaging (MRI)
scanner (G-Scan; Esaote Biomedica, Genoa, Italy).","A minimum of two
maximal voluntarily isometric leg extensions (MVCs) were performed on the chair of an isokinetic dynamometer (Cybex Norm; Cybex International, New York,
NY, USA) at 70, 80 and 90
 of knee flexion.  Each MVC lasted 2–3 s with a rest interval of 2 min between each contraction. Antagonist
muscle co-activation was estimated by determining the electromyographic (EMG) activity of the biceps femoris muscle during MVC. The interpolated twitch technique was used to determine the level of maximal voluntary QF muscle activation at 90
 of knee flexion. This level
of activation was applied to the MVC at optimum
angle, which, when corrected for antagonist muscle co-activation, provided true maximum torque (TMT). To calculate maximum QF muscle force recorded at the patellar tendon, it was necessary to divide TMT by the patellar tendon moment arm length (dPT).
Maximum patellar tendon
force (Ft) was thus calculated as TMT/dPT.","","","","","","","","Non-randomised experimental study","Untrained ","20.1 SD 2.3","176.9 SD 4.7","76.1 SD 10.1","","","","","","","","","","","","","","","","","17, Before training","Male","QF","2074 SD 221","VL 8.8 SD 1.1
VI 10.3 SD 1.9
RF 7.2 SD 1.7
VM 10.3 SD 1.2 
","231 SD 24","V","269 SD 50","6296 SD 988","29.5 SD 4.1 "," The volume of each
of the component QF muscles [vastus lateralis (VL), vastus intermedius (VI), rectus femoris (RF) and vastus medialis (VM)] was calculated from serial axial MRI","Fascicle length (Lf) and pennation angle (hp) of the VL, VI, RF and VM muscles were measured during MVC using ultrasonography along the mid-sagittal plane at
50% of the length of each muscle. ","Dividing each compo-
nent muscle volume by its respective Lf provided the PCSA of the individual muscles. he sum of these four PCSAs gave the whole QF PCSA (Erskine et al. 2009).","dPT was determined from sagittal and coronal-plane knee scans
obtained from a magnetic resonance imaging (MRI)
scanner (G-Scan; Esaote Biomedica, Genoa, Italy).","A minimum of two
maximal voluntarily isometric leg extensions (MVCs) were performed on the chair of an isokinetic dynamometer (Cybex Norm; Cybex International, New York,
NY, USA) at 70, 80 and 90
 of knee flexion.  Each MVC lasted 2–3 s with a rest interval of 2 min between each contraction. Antagonist
muscle co-activation was estimated by determining the electromyographic (EMG) activity of the biceps femoris muscle during MVC. The interpolated twitch technique was used to determine the level of maximal voluntary QF muscle activation at 90
 of knee flexion. This level
of activation was applied to the MVC at optimum
angle, which, when corrected for antagonist muscle co-activation, provided true maximum torque (TMT). To calculate maximum QF muscle force recorded at the patellar tendon, it was necessary to divide TMT by the patellar tendon moment arm length (dPT).
Maximum patellar tendon
force (Ft) was thus calculated as TMT/dPT.","As the force generated by each component QF muscle would be reduced according to
the hp when resolved along the patellar tendon, each constituent muscle PCSA was multiplied by the cosine
of its respective hp to provide four reduced PCSAs.
Maximum patellar tendon force was subsequently divided by the sum of these reduced PCSAs to provide QF specific tension.","","17 After training ","","","2188 SD 245","VL 8.8 SD 1.2
VI 10.4 SD 1.6
RF 7.4 SD 1.9
VM 10.3 SD 1.3","245 SD 34 ","V ","350 SD 57","8023 SD 826","25.5 SD 5.1 ","","","","","","","","","","","","","","","","","","","","","","","","","","","","","","","","","","","","","","","","","","","","","","","","","","","","","","","","","","","","","","","","","","","","","","","","","","","","","","","","","","","","","","","","","","","","","","","","","","","","","","","","","",""
